,Query,Class Code,Class Title,Class Description
140,lgbt,SOCI 119,Sociology of Sexuality and Sexual Identities,"Introduction both to the sociological study of sexuality and to sociological perspectives in gay/lesbian studies. Examines the social construction of sexual meanings, identities, movements, and controversies; the relation of sexuality to other institutions; and the intersection of sexuality with gender, class, and race."
141,lgbt,RELI 131,Topics in Religion and Sexuality,How does religiosity as a significant cultural component help mold gender and sexuality identities? The class offers topical investigations into this question.
142,lgbt,ANSC 125GS,"Gender, Sexuality, and Society","How are gender and sexuality shaped by cultural ideologies, social institutions, and social change? We explore their connections to such dimensions of society as kinship and family, the state, religion, and popular culture. We also examine alternative genders/sexualities cross-culturally. Students may not receive credit for ANSC 125GS and ANSC 125. Program or materials fees may apply."
143,lgbt,ANSC 125,"Gender, Sexuality, and Society","How are gender and sexuality shaped by cultural ideologies, social institutions, and social change? We explore their connections to such dimensions of society as kinship and family, the state, religion, and popular culture. We also examine alternative genders/sexualities cross-culturally. Students may not receive credit for ANSC 125 and ANSC 125GS."
144,lgbt,CGS 117,Transgenderisms,"(Cross-listed with ANSC 117.) This course contrasts mainstream Anglo-American conceptualizations of transgenderism with ethnographic accounts of the experiences and practices of gender expansive people of color (African, Native, Asian/Pacific Islander, and Latinx Americans) in the United States and abroad. It will question the idea of transgenderism as a crossing from one gender to another one, the distinction between gender identity and sexuality, and the analytic of intersectionality. Students will not receive credit for both CGS 117 and ANSC 117."
145,latin american history,HILA 144,Topics in Latin American History,Selected topics in Latin American history. Course may be taken for credit up to three times as topics vary (the course subtitle will be different for each distinct topic). Students who repeat the same topic in HILA 144 will have the duplicate credit removed from their academic record.
146,latin american history,HILA 161,History of Women in Latin America,"A broad historical overview of Latin American women’s history of focusing on the issues of gender, sexuality, and the family as they relate to women, as well as the historiographical issues in Latin American and Chicana women’s history."
147,latin american history,HILA 261,History of Women in Latin America,"A broad historical overview of Latin American women’s history of focusing on the issues of gender, sexuality, and the family as they relate to women, as well as the historiographical issues in Latin American and Chicana women’s history."
148,latin american history,HILA 168,Scholarship on Latin American History in the Nineteenth Century,"Introduction to the historiography on Latin America for the nineteenth century: world economy, nation-state building, agrarian processes, incipient industrialization, political and cultural thought, and social structure. Requirements will vary for undergraduate, MA, and PhD students. Graduate students are required to submit an additional research paper."
149,latin american history,HILA 268,Scholarship on Latin American History in the Nineteenth Century,"Introduction to the historiography on Latin America for the nineteenth century: world economy, nation-state building, agrarian processes, incipient industrialization, political and cultural thought, and social structure. Requirements will vary for undergraduate, MA, and PhD students. Graduate students are required to submit an additional research paper."
150,language models,LIGN 252,Advanced Probabilistic Models of Language,"Probabilistic techniques for data analysis and modeling of linguistics cognition. Hierarchical (mixed-effects) regression, graphical models, Bayesian methods, latent-variable models, nonparametric models, probabilistic grammars. Course covers both mathematical foundations and working with datasets using state-of-the-art computational tools. Recommended prerequisite: LIGN 251 or equivalent course with emphasis on probabilistic methods in linguistics."
151,language models,LIGN 165,Computational Linguistics,"An introduction to the fundamental concepts of computational linguistics, in which we study natural language syntax and semantics from an interpretation perspective, describe methods for programming computer systems to perform such interpretation, and survey applications of computational linguistics technology."
152,language models,LIGN 245,Computational Corpus Linguistics,Introduction to computational corpus tools for performing empirically grounded linguistic investigations. Annotated and unannotated corpora; annotation schemes. Searching using regular expressions. UNIX tools. The PERL programming language. Publicly available language processing systems.
153,language models,COGS 101C,Language,"An introduction to structure of natural language, and to the cognitive processes that underline its acquisition, comprehension, and production. This course covers findings from linguistics, computer science, psychology, and cognitive neuroscience to provide an integrated perspective on human language abilities."
154,language models,CSE 256,Statistical Natural Language Processing,"An introduction to modern statistical approaches to natural language processing: part of speech tagging, word sense disambiguation and parsing, using Markov models, hidden Markov models, and probabilistic context-free grammars. Recommended preparation: LIGN 165, LIGN 245, CSE 151, CSE 250A, or CSE 254."
155,java,CSE 86,C++ for Java Programmers,"Helps the Java programmer to be productive in the C++ programming environment. Topics include the similarities and differences between Java and C++ with special attention to pointers, operator overloading, templates, the STL, the preprocessor, and the C++ Runtime Environment."
156,java,EDS 324CR,Learn to Teach Java,Examine issues in teaching and learning of programming in Java with a focus teaching of secondary-level students. Teaching and learning of algorithms; data structures and representation; searching and sorting; basic software design processes and impacts on society. Developing an educational infrastructure and professional community that supports computing in traditional K-12 environments. Experience with block-based programming is recommended.
157,java,CSE 6R,Introduction to Computer Science and Object-Oriented Programming: Python,"An introduction to computer science and programming using the Python language. The course will cover topics such as basic data types (e.g., integer, float, string), loops and iteration, basic data structures (e.g., list, set, dictionary), memory models, conditional statements, recursion, basic algorithm time complexity analysis, class design, and inheritance."
158,java,LIGN 121,Syntax I,What universal principles determine how words combine into phrases and sentences? Introduction to research methods and results. Emphasis on how argumentation in problem-solving can be used in the development of theories of language.
159,java,CSE 12,Basic Data Structures and Object-Oriented Design,"Use and implementation of basic data structures including linked lists, stacks, and queues. Use of advanced structures such as binary trees and hash tables. Object-oriented design including interfaces, polymorphism, encapsulation, abstract data types, pre-/post-conditions. Recursion. Uses Java and Java Collections."
160,introduction to calculus,MATH 10A,Calculus I,"Differential calculus of functions of one variable, with applications. Functions, graphs, continuity, limits, derivatives, tangent lines, optimization problems. (No credit given if taken after or concurrent with MATH 20A.)"
161,introduction to calculus,MATH 20A,Calculus for Science and Engineering,"Foundations of differential and integral calculus of one variable. Functions, graphs, continuity, limits, derivative, tangent line. Applications with algebraic, exponential, logarithmic, and trigonometric functions. Introduction to the integral. (Two credits given if taken after MATH 1A/10A and no credit given if taken after MATH 1B/10B or MATH 1C/10C. Formerly numbered MATH 2A.)"
162,introduction to calculus,MATH 10B,Calculus II,"Integral calculus of functions of one variable, with applications. Antiderivatives, definite integrals, the Fundamental Theorem of Calculus, methods of integration, areas and volumes, separable differential equations. (No credit given if taken after or concurrent with MATH 20B.)"
163,introduction to calculus,MATH 20B,Calculus for Science and Engineering,"Integral calculus of one variable and its applications, with exponential, logarithmic, hyperbolic, and trigonometric functions. Methods of integration. Infinite series. Polar coordinates in the plane and complex exponentials. (Two units of credits given if taken after MATH 1B/10B or MATH 1C/10C.)"
164,introduction to calculus,MATH 20D,Introduction to Differential Equations,"Ordinary differential equations: exact, separable, and linear; constant coefficients, undetermined coefficients, variations of parameters. Systems. Series solutions. Laplace transforms. Techniques for engineering sciences. Computing symbolic and graphical solutions using MATLAB. (Formerly numbered MATH 21D.) May be taken as repeat credit for MATH 21D."
165,image processing,CSE 166,Image Processing,"Principles of image formation, analysis, and representation. Image enhancement, restoration, and segmentation; stochastic image models. Filter design, sampling, Fourier and wavelet transforms. Selected applications in computer graphics and machine vision."
166,image processing,COGS 225,Image Recognition,"This course is designed to open the doors for students who are interested in learning about the basic tools and technologies for image classification and recognition. We will focus on traditional computer vision techniques as well as graphics processing unit (GPU) powered deep learning techniques that are critical to modern image data analysis such as large-scale image recognition, object detection, and video analysis."
167,image processing,ECE 253,Fundamentals of Digital Image Processing,"Image quantization and sampling, image transforms, image enhancement, image compression. Recommended preparation: ECE 109, 153, ECE 161, ECE 161A."
168,image processing,DSC 254,Statistical Signal and Image Analysis,"A graduate level course on signal and image analysis spanning three main themes. Statistical signal processing: random processes, stochasticity, stationarity, Wiener filter, Kalman filter, matched filter; signal processing: time-frequency representations, wavelets, signal processing with sparse representation (dictionary learning); image processing: registration, image degradation and restoration: noise models + denoising, image pyramids, random fields."
169,image processing,CSE 252A,Computer Vision I,"Comprehensive introduction to computer vision providing broad coverage including low-level vision (image formation, photometry, color, image feature detection), inferring 3-D properties from images (shape-from shading, stereo vision, motion interpretation) and object recognition. Companion to CSE 252B covering complementary topics."
