,Query,Class Code,Class Title,Class Description
68,organic chemistry,CHEM 143C,Organic Chemistry Laboratory,Identification of unknown organic compounds by a combination of chemical and physical techniques. Enrollment is limited to majors in the Department of Chemistry and Biochemistry unless space is available. Program or materials fees may apply.
69,organic chemistry,CHEM 40C,Organic Chemistry III,"Renumbered from CHEM 140C. Continuation of CHEM 40A, Organic Chemistry I and CHEM 40B, Organic Chemistry II. Organic chemistry of biologically important molecules: carboxylic acids, carbohydrates, proteins, fatty acids, biopolymers, natural products. Students may only receive credit for one of the following: CHEM 40C, 40CH, 140C, or 140CH."
70,optimization,MATH 271A,Numerical Optimization,Formulation and analysis of algorithms for constrained optimization. Optimality conditions; linear and quadratic programming; interior methods; penalty and barrier function methods; sequential quadratic programming methods.
71,optimization,MATH 271B,Numerical Optimization,Formulation and analysis of algorithms for constrained optimization. Optimality conditions; linear and quadratic programming; interior methods; penalty and barrier function methods; sequential quadratic programming methods.
72,optimization,MATH 271C,Numerical Optimization,Formulation and analysis of algorithms for constrained optimization. Optimality conditions; linear and quadratic programming; interior methods; penalty and barrier function methods; sequential quadratic programming methods.
73,optimization,DSC 243,Advanced Optimization,"Linear/quadratic programming, optimization under constraints, gradient descent (deterministic and stochastic), convergence rate of gradient descent, acceleration phenomena in convex optimization, stochastic optimization with large data sets, complexity lower bounds for convex optimization."
74,optimization,DSC 211,Introduction to Optimization,"Continuity and differentiability of a function of several variables, gradient vector, Hessian matrices, Taylor approximation, fundamentals of optimization, Lagrange multipliers, convexity, gradient descent."
75,ocean,SIO 30,The Oceans,"Presents modern ideas and descriptions of the physical, chemical, biological, and geological aspects of oceanography, and considers the interactions between these aspects. Intended for students interested in the oceans, but who do not necessarily intend to become professional scientists."
76,ocean,SIOC 211A,Ocean Waves I,"Propagation and dynamics of waves in the ocean, including the effects of stratification, rotation, topography, wind, and nonlinearity."
77,ocean,SIO 174,Chemistry of the Atmosphere and Oceans,"An introduction to chemical compounds and their biogeochemical cycles in the oceans and atmosphere, with emphasis on climate issues like ocean acidification, greenhouse gases and the carbon cycle, other biogeochemical cycles, chlorofluorocarbons and the ozone hole, urban pollutants and their photochemistry, and aerosol particles and their effects on clouds."
78,ocean,SIO 3,Life in the Oceans,"An introduction to the wide variety of organisms that live in the oceans, the habitats they occupy, and how species interact with each other and their environment. Included will be examinations of adaptations, behavior, ecology, and a discussion of local and global resource management and conservation issues. This course is designed for nonbiology majors."
79,ocean,SIO 119,Physics and Chemistry of the Oceans,"Basic physical and chemical processes that influence the biology of the oceans, such as ocean circulation, ocean acidification, carbonate chemistry, trace metal chemistry."
80,natural language processing,DSC 258R,Natural Language Processing,"Introduction to classical methods that are useful in analyzing and mining real-world text data, including tokenization, stemming and lemmatization, bag-of-words classification, word embedding, language models, sentiment analysis, part-of-speech tagging, named entity recognition, and sequence-to-sequence models. Consideration of possible biases, privacy, and societal implications in these models. This is a distance education course."
81,natural language processing,CSE 156,Statistical Natural Language Processing,"Natural language processing (NLP) is a field of AI which aims to equip computers with the ability to intelligently process natural (human) language. This course will explore statistical techniques for the automatic analysis of natural language data. Specific topics covered include probabilistic language models, which define probability distributions over text passages; text classification; sequence models; parsing sentences into syntactic representations; and machine translation."
82,natural language processing,CSE 256,Statistical Natural Language Processing,"An introduction to modern statistical approaches to natural language processing: part of speech tagging, word sense disambiguation and parsing, using Markov models, hidden Markov models, and probabilistic context-free grammars. Recommended preparation: LIGN 165, LIGN 245, CSE 151, CSE 250A, or CSE 254."
83,natural language processing,LING 256,Statistical Natural Language Processing,"An introduction to modern statistical approaches to natural language processing: part of speech tagging, word sense disambiguation and parsing, using Markov models, hidden Markov models, and probabilistic context-free grammars. Recommended preparation: LIGN 165, LIGN 245, CSE 151, CSE 250A, or CSE 254."
84,natural language processing,LIGN 256,Statistical Natural Language Processing,"(Same as CSE 256.) Introduction to modern statistical approaches to natural language processing: part-of-speech tagging, word-sense disambiguation and parsing, using Markov models, hidden Markov models, and probabilistic context-free grammars. Recommended"
85,neuroscience,PSYC 106,Behavioral Neuroscience,"This course provides a comprehensive overview of human and animal behavior from a neuroscience perspective. Topics include the functions and mechanisms of perception, motivation (sex, sleep, hunger, emotions), learning and memory, and motor control and movement."
86,neuroscience,PHIL 151,Philosophy of Neuroscience,"An introduction to elementary neuroanatomy and neurophysiology and an examination of theoretical issues in cognitive neuroscience and their implications for traditional philosophical conceptions of the relation between mind and body, perception, consciousness, understanding, emotion, and the self."
87,neuroscience,PSYC 102,Sensory Neuroscience,"This course provides a comprehensive overview of the neural mechanisms that support vision, audition, touch, olfaction, and taste."
88,neuroscience,COGS 107B,Systems Neuroscience,"This course focuses on the electrical dynamics of neurons and how their patterns relate to perception, thought, and action. Neural activity patterns underlying vision, touch, audition, proprioception, and head orientation are examined in detail. Also examined are motor control, sleep/wake state production, action planning, learning, memory, attention, spatial cognition and function of the cerebellum, basal ganglia, and hippocampus."
89,neuroscience,COGS 107C,Cognitive Neuroscience,"This course reviews research investigating the neural bases for human mental processes, including processing of affective, social, linguistic, and visuospatial information, as well as memory, attention, and executive functions. Also discussed are brain development and brain aging, and the nature of intelligence and creativity."
90,neural networks,COGS 181,Neural Networks and Deep Learning,"This course will cover the basics about neural networks, as well as recent developments in deep learning including deep belief nets, convolutional neural networks, recurrent neural networks, long-short term memory, and reinforcement learning. We will study details of the deep learning architectures with a focus on learning end-to-end models for these tasks, particularly image classification. Students may receive credit for one of the following: COGS 181, CSE 151B, or CSE 154."
91,neural networks,COGS 138,Neural Data Science,"Project-based course in which students will use computational notebooks to perform exploratory data analyses and to test hypotheses in large neuroscience datasets, including the differences between unique neuron types, leveraging text mining of the neuroscience literature, and human neuroimaging analyses."
92,neural networks,BIPN 162,Neural Data Science,"Project-based course in which students will use computational notebooks to perform exploratory data analyses and to test hypotheses in large neuroscience data sets, including the differences between unique neuron types, leveraging text mining of the neuroscience literature, and human neuroimaging analyses."
93,neural networks,BGGN 240,Neural Data Science,"Project-based course in which students will use computational notebooks to perform exploratory data analyses and to test hypotheses in large neuroscience data sets, including the differences between unique neuron types, leveraging text mining of the neuroscience literature, and human neuroimaging analyses. Enrollment restricted to MS students only in the following major code: BI84, BI87. May be coscheduled with BIPN 162."
94,neural networks,BENG 147B,Design Implementation in Neural Engineering,Implementation of design project in neural engineering.
95,native american,ANSC 145,Indigenous Peoples of North America,"This course addresses: 1) Diversity among traditional Native American cultures with respect to social organization, religion, environmental adaptation, subsistence, and reaction to colonial conquest and domination; and, 2) Contemporary social issues including tribal sovereignty, religious freedom, health, education, gambling, and repatriation of artifacts/remains."
96,native american,ETHN 214A,Representing Native America,"This course provides an introduction to the history and theory of museum representation of American Indians in order to explore its relation to colonialism and decolonization. In addition to a wide-ranging look at the complex foundations of systems of representing Indians and Indianness, the course includes a study of a specific art form and history of a specific Native American community that will allow the class to create new approaches to designing a museum exhibition. May be co-scheduled with ETHN 114A."
97,native american,ETHN 112A,History of Native Americans and Indigenous Peoples in the U,"This course examines the histories of Native American, Pacific Islander, and other indigenous populations in the United States, with specific emphasis on precolonial and postcontact interaction and knowledge systems of indigenous groups from the 1400s to mid-nineteenth century."
98,native american,ETHN 112B,History of Native Americans and Indigenous Peoples in the U,"This course examines the history of Native American, Pacific Islander, and other indigenous populations in the United States, with specific emphasis on and analyses of postcontact interactions, federal laws and policies, and decolonial efforts among American Indians, Pacific Islanders, other tribal communities, and indigenous peoples/nations in the United States from the late nineteenth century to the present."
99,native american,ETHN 114A,Representing Native America,History and theory: Introduction to the history and theory of museum representation of American Indians in order to explore its relation to colonialism and decolonization. Study of Plains Indian drawings from 1860 to 1890 will allow the class to create new approaches to designing a museum exhibition.
100,national security,POLI 142I,National and International Security,A survey of theories of defense policies and international security.
101,national security,POLI 142J,National Security Strategy,"A survey of American strategies for national defense. Topics may include deterrence, coercive diplomacy, limited war, and unconventional warfare."
102,national security,POLI 243,International Security,A colloquium surveying the major theoretical controversies in the study of international and national security.
103,national security,POLI 149,"Spies, Intelligence, and US National Security","Information is the key to success and failure in US foreign policy. This course will cover the American intelligence community’s secret and information gathering processes. The curriculum is organized by the specialist functions of real-world IC professionals. You will learn methods for collecting raw data, including human and signals intelligence, how that data is synthesized into intelligence, the different reporting formats that drive national security decisions, and about oversight and ethical issues."
104,national security,POLI 142M,US Foreign Policy/Regional Security,"Lectures and readings examine US foreign policy in Europe, Latin America, and East Asia with attention to current problems with specific nations (e.g., Bosnia) and issues (e.g., terrorism). This course integrates historical, comparative, and foreign perspectives on regional security dynamics."
105,movies,RELI 150,Religion and Cinema,"The course is an introductory study of cinema and religion. It explores how cinema depicts religion and spiritual experience. A number of films will be studied to understand how cinematic and religious narratives and practices overlap and, at times, diverge in complex ways."
106,movies,VIS 7,Movie Magic: From Méliès to Marvel,"Looking at spectacle in motion pictures, the illusion of cinema, and visual effects in popular media. This class will introduce students to the history of special and visual effects in film and video, from the earliest cinematic experiments to experimental film and modern-day blockbusters. We will examine the integration of technology with image-making and storytelling and look at the exciting ways artists make the impossible come alive on screen."
107,movies,VIS 194S,Fantasy in Film,"This course will explore the path of the deliberately “unreal” in movies. Fantasy in film will be considered in terms of its cultural and creative appearance in motion pictures, looking at imaginary worlds and stories in such genres as science fiction, horror, and musical films. Offered in Summer Session only. Program or materials fees may apply. May be taken for credit three times."
108,movies,NO RESULTS,NO RESULTS,NO RESULTS
109,movies,NO RESULTS,NO RESULTS,NO RESULTS
110,modern art,VIS 124G,Art and Modernity,"A critical study of mid- to late nineteenth-century painting, sculpture, and printmaking in Europe. Key artists, or groups of artists, include Gustave Courbet, the Pre-Raphaelites, Adolph Menzel, Edouard Manet, the Impressionists, the Neoimpressionists, Vincent van Gogh, Paul Gauguin, Paul Cézanne, the Nabis, Auguste Rodin, James Ensor, and others."
111,modern art,LTTH 255,Modern Art Movements and Aesthetics,"An introduction to modernist aesthetics with a focus on art and literary movements. Particular attention to be placed on relationships between modern literary movements (realism, imagism, surrealism) and their counterparts in visual arts, music, dance, and theatre, and the ways in which literary movements are components of or responses to issues of political and social identity. Restricted to major code LT84 or consent of instructor and department."
112,modern art,VIS 22,Formations of Modern Art,"A wide-ranging survey introducing the key aspects of global art and criticism in the nineteenth and twentieth centuries. The course will comparatively examine formations of modernism and modernity within and across a variety of aesthetic traditions in Africa, Asia, Europe, Latin America, North America, and Oceania."
113,modern art,VIS 125BN,Contemporary Art,"Art after abstract expressionism: happenings, postpainterly abstraction, minimalism, performance, earth art, conceptual art, neo-expressionism, postconceptualism and development in the 1990s, including non-Western contexts. We also explore the relation of these tendencies to postmodernism, feminism, and ideas of postcoloniality. Recommended preparation: VIS 20 or 22 recommended."
114,modern art,VIS 128C,Topics in Modern Art History,A lecture course on a topic of special interest on modern or contemporary art. May be taken three times for credit. Recommended preparation: courses in art history (VIS 113AN–129F).
115,middle east,HINE 120,The Middle East in the New Century,"An examination of the conflicts, changes, and continuities in the Middle East since 2000. The course includes inspection of the US role in Iraq and the region generally."
116,middle east,HINE 108,The Middle East before Islam,"The peoples, politics, and cultures of Southwest Asia and Egypt from the sixth century BCE to the seventh century CE. The Achaemenid Empire, the Ptolemaic and Seleucid kingdoms, the Roman Orient, the Parthian and Sasanian states. +"
117,middle east,ECON 165,Middle East Economics,"Socioeconomic development in the Arab world, Iran, and Turkey. Historical perspective; international trade and fuel resources; education, health, and gender gaps; unemployment and migration; population and environment; Islam and democracy."
118,middle east,HINE 118,The Middle East in the Twentieth Century,"An introduction to the history of the Middle East since 1914. Themes such as nationalism, imperialism, the oil revolution, and religious revivalism will be treated within a broad chronological and comparative framework drawing on the experience of selected countries."
119,middle east,HINE 165,The Colonial Mandates in the Middle East,A colloquium focusing on the problems and patterns in the emergence of modern Middle Eastern states since 1920.
120,mental health,GLBH 171R,Global Mental Health,"Global Mental Health (GMH) is a field of research, practice, and advocacy prioritizing mental health for all persons and communities worldwide. GMH recognizes mental, neurological, or substance use disorders as the leading causes of disability worldwide and works to counteract social stigma and discrimination commonly associated with such conditions. The course introduces this interdisciplinary field based on analysis of and writing about critical sources from the relevant scholarly literature."
121,mental health,ANTH 276,Global Mental Health,"(Cross-listed with GLBH 274.) This course will examine core topics in global mental health research and practice, including cross-cultural classification of mental illness, stigma, and intervention. It combines anthropological perspectives alongside cross-cultural psychiatry, epidemiology, humanities, and global public health. The course highlights mixed method approaches to research, intervention design, and evaluation. The seminar includes a combination of interactive lectures, discussion, and hands-on activities."
122,mental health,ANTH 259,Gender and Mental Health,"This seminar in psychological/psychiatric anthropology takes a comparative approach to the study of gender and mental health. Culture and feminist theory is employed to address questions of gender in relation to various problems, such as depression, anxiety, and eating disorders."
123,mental health,ANTH 249,Gender and Mental Health,"This course examines gender and mental health by considering social, cultural, and biological explanations for problems such as depression, trauma, anxiety, drugs/alcohol use. Cross-cultural similarities and differences of gender are considered with respect to etiology, epidemiology, symptomatology, treatment, and recovery."
124,mental health,GLBH 274,Global Mental Health,"(Cross-listed with ANTH 276.) This course will examine core topics in global mental health research and practice, including cross-cultural classification of mental illness, stigma, and intervention. It combines anthropological perspectives alongside cross-cultural psychiatry, epidemiology, humanities, and global public health. The course highlights mixed-method approaches to research, intervention design, and evaluation. The seminar includes a combination of interactive lectures, discussion, and hands-on activities."
125,marketing,MGT 407,Marketing,"By taking an analytical approach to the study of marketing problems, this course provides an understanding of customers and competitors as a basis for developing, pricing, promoting, and distributing goods and services that satisfy customer and organizational objectives. Letter grades only."
126,marketing,ECON 176,Marketing,"Role of marketing in the economy. Topics such as buyer behavior, marketing mix, promotion, product selection, pricing, and distribution. Concurrent enrollment in ECON 120C is permitted."
127,marketing,GPIM 420,Marketing,"The role and function of marketing in organizations and society. Attention is given to the analysis of markets and customers using primary and secondary sources of information and the planning, implementation, and evaluation of marketing strategies and programs. Renumbered from IRGN 420. Students may not receive credit for GPIM 420 and IRGN 420."
128,marketing,MGT 476,Marketing Strategy,"Addresses formulation and implementation of marketing strategy based on an integrative view of competitive brand strategy over the product life cycle. Provides a framework for developing marketing strategies yielding sustainable competitive advantage based on customer, competitor, industry, and environmental analysis. Students may not earn credit for both MGT 476 and MGT 201. They are course equivalents."
129,marketing,MGT 478,Marketing Communications,"This course differentiates decisions/principles considered when developing an overall communications and promotions strategy. Key decisions include the promotional mix, the design, implementation and evaluation of communications strategies and the thinking required to develop a creative strategy. Students may not earn credit for both MGT 478 and MGT 204. They are course equivalents."
130,marine biology,SIOB 290,Marine Biology,"An introduction to the field of marine biology, especially to the diversity of marine organisms at all taxonomic levels and their adaptations to the marine environment."
131,marine biology,BIEB 130,Marine Conservation Biology,"Course integrates principles of ecology and marine biology to examine marine biodiversity loss from overexploitation, habitat loss, invasion, climate change, and pollution. We examine consequences of biodiversity loss to marine ecosystems, discuss management regimes, and address global and local ocean conservation problems. Course includes basic overviews of climate, marine biology, and oceanography that may be similar to topics covered in introductory courses at Scripps Institution of Oceanography."
132,marine biology,SIO 133,Marine Mammal Biology,"Introduction to the biology, ecology, evolution, and conservation status of marine mammals. Description of marine mammal taxa (mysticetes, odontocetes, pinnipeds, sirenians), their anatomy, physiology, ecology, and behavior. Impacts of whaling, fisheries interactions, and other anthropogenic threats."
133,marine biology,SIO 132,Introduction to Marine Biology,"Overview of marine organisms and their adaptations to sea life. Selected examples of physiological, behavioral, and evolutionary adaptations in response to the unique challenges of a maritime environment."
134,marine biology,SIO 127,Marine Molecular Ecology,This course will survey the application of molecular methods to address diverse questions concerning the ecology and evolutionary biology in marine organisms. Focus will be on genetic and genomic approaches that are providing new insights into how marine organisms adapt to their physical and biotic environments.
135,machine learning,DSC 240,Machine Learning,"A graduate level course in machine learning algorithms: decision trees, principal component analysis, k-means, clustering, logistic regression, random forests, boosting, neural networks, kernel methods, deep learning."
136,machine learning,DSE 220,Machine Learning,"This course provides a broad introduction to the practical side of machine learning and data analysis. The topics covered in this class include topics in supervised learning, such as k-nearest neighbor classifiers, decision trees, boosting and perceptrons, and topics in unsupervised learning, such as k-means, PCA, and Gaussian mixture models."
137,machine learning,CSE 151A,Introduction to Machine Learning,"Broad introduction to machine learning. The topics include some topics in supervised learning, such as k-nearest neighbor classifiers, decision trees, boosting, and perceptrons; and topics in unsupervised learning, such as k-means and hierarchical clustering. In addition to the actual algorithms, the course focuses on the principles behind the algorithms. Students may not receive credit for both CSE 151A and COGS 188, nor may they receive credit for both CSE 151A and CSE 151."
138,machine learning,COGS 118A,Supervised Machine Learning Algorithms,"This course introduces the mathematical formulations and algorithmic implementations of the core supervised machine learning methods. Topics in 118A include regression, nearest neighborhood, decision tree, support vector machine, and ensemble classifiers. COGS 118A-B may be taken in either order."
139,machine learning,MAE 146,Introduction to Machine Learning Algorithms,"An introduction to the principles used to design and implement machine learning algorithms, as well as an understanding of their advantages and limitations. The topics covered are python review, supervised learning (linear, logistic/sigmoid regression, generalized linear models, nonlinear regression via Kernels), neural network types (convolutional, recurrent, deep NN), unsupervised learning (k-means clustering). Application of ML in different examples. Recommended preparation: ECE 143 and/or python programming knowledge."
