Query,Class Code,Class Title,Class Description
2d art,VIS 1,Introduction to Art Making: Two-Dimensional Practices,"An introduction to the concepts and techniques of two-dimensional art making with an emphasis on drawing. Lectures and studio classes will introduce skills and concepts of contemporary drawing practice in relation to a variety of genres such as illustration, comics, advertising, animation, and other forms of visualization. This course is offered only one time each year."
2d art,VIS 106A,Painting: Image Making,"A studio course focusing on problems inherent in painting—transferring information and ideas onto a two-dimensional surface, color, composition, as well as manual and technical procedures. These concepts will be explored through the use of models, still life, and landscapes."
2d art,VIS 2,Introduction to Art Making: Motion and Time-Based Art,"An introduction to art making utilizing the transaction between people, objects, situations, and media. Includes both critical reflection on relevant aspects of modern and contemporary art practices (Marina Abramovic, Allen Kaprow, Adrian Piper, James Luna, Stelarc, Ron Athey, conceptual art, performance art, new media art, etc.) and practical experience in a variety of artistic exercises. This course is offered only one time each year."
2d art,VIS 105A,Drawing: Representing the Subject,"A studio course in beginning drawing covering basic drawing and composition. These concepts will be introduced by the use of models, still life, landscapes, and conceptual projects."
2d art,VIS 3,Introduction to Art Making: Three-Dimensional Practices,An introduction to art making that uses as its base the idea of the “conceptual.” The lecture exists as a bank of knowledge about various art world and nonart world conceptual plays. The studio section attempts to incorporate these ideas into individual and group projects using any “material.” This course is offered only one time each year.
accounting,MGT 404,Accounting,"Through lecture and online delivery, students will be introduced to the basic concepts and methods used in financial statements. The course highlights the linkages between accounting information and management planning, decision making, and control. Letter grades only."
accounting,MGTF 401,Financial Accounting,"Overview of financial accounting reporting, with a primary focus on the analysis of economic events and their effect on the major financial statements (balance sheet, income statement, and statement of cash flows). Learn the nature and purpose of accounting methods. Letter grades only. Students may not receive credit for both MGTF 401 and MGT 404."
accounting,MGT 4,Financial Accounting,"Cross-listed with ECON 4. Recording, organizing, and communicating financial information to business entities."
accounting,ECON 4,Financial Accounting,"(Cross-listed with MGT 4.) Recording, organizing, and communicating financial information relating to business entities. Credit not allowed for both ECON 4 and MGT 4."
accounting,MGT 138,Information Technology and Accounting,"This course provides an introduction to the role and use of models and modeling in managerial decision-making. Students will gain hands-on experience in evaluating accounting data using Microsoft Excel. Content includes creating data boxes in financial accounting, using multiple sheets with formulas, preparing professional quality financial reports, and creating graphs to interpret business results. Students will also explore the utility of QuickBooks and the functionality for small businesses."
acting,TDAC 101,Acting I,This course focuses on beginning scene study with an emphasis on exploring action/objective and the given circumstances of a selected text.
acting,TDAC 1,Introduction to Acting,"A beginning course in the fundamentals of acting: establishing a working vocabulary and acquiring the basic skills of the acting process. Through exercises, compositions, and improvisations, the student actor explores the imagination as the actor’s primary resource, and the basic approach to text through action."
acting,TDGR 233,Acting for the Camera,This course is designed to aid the actor in the transition from stage to film work. Examination of film production and its physical characteristics and the acting style needed for work in film and television. Students will rehearse and perform in simulated studio setting.
acting,TDDR 111,Directing-Acting Process,"A studio class that investigates the fundamental skills a director needs to work with actors. Working with actors, students learn how to animate the text onstage through status exercises and scene work as they develop their skill in text work, staging, and dramatic storytelling."
acting,TDAC 110,Acting for the Camera,This course is designed to aid the actor in the transition from stage to film work. Examination of film production and its physical characteristics and the acting style needed for work in film and television. Students will perform in simulated studio setting on camera.
advance biological topics,BISP 194,Advanced Topics in Modern Biology,"Course will vary in title and content. Students are expected to actively participate in course discussions, read, and analyze primary literature. Current descriptions and subtitles may be found on the Schedule of Classes and the School of Biological Sciences website. Students may receive credit in 194 courses a total of four times as topics vary. Students may not receive credit for the same topic."
advance biological topics,BGGN 285,Advanced Topics in Modern Biology,"Course will vary in title and content. Students are expected to actively participate in course discussions, read, and analyze primary literature. Current descriptions and subtitles may be found on the Schedule of Classes and the School of Biological Sciences website. Enrollment restricted to MS students only in the following major code: BI84, BI87. May be taken for credit up to four times. Students may receive credit only once for BGGN 285 on a given topic. May be coscheduled with BISP 194. Students may not receive credit for BGGN 285 on the same topic taken previously as BISP 194."
advance biological topics,BIBC 194,Advanced Topics in Modern Biology: Biochemistry,"Course will vary in title and content. Students are expected to actively participate in course discussions, read, and analyze primary literature. Current descriptions and subtitles may be found on the Schedule of Classes and the School of Biological Sciences website. Students may receive credit in 194 courses a total of four times as topics vary. Students may not receive credit for the same topic."
advance biological topics,BGGN 280,Advanced Topics in Modern Biology: Biochemistry,"Course will vary in title and content. Students are expected to actively participate in course discussions, read, and analyze primary literature. Current descriptions and subtitles may be found on the Schedule of Classes and the School of Biological Sciences website. Enrollment restricted to MS students only in the following major code: BI84, BI87. May be taken for credit up to four times. Students may receive credit only once for BGGN 280 on a given topic. May be coscheduled with BIBC 194. Students may not receive credit for BGGN 280 on the same topic taken previously as BIBC 194."
advance biological topics,BILD 92,Professional Development Topics in the Biological Sciences,"Seminars will introduce students to various professional development topics in the biological sciences. Emphasis may include current research in academe and industry, using campus and community resources to help achieve academic, personal and professional goals, and career exploration. Activities may include presentations by faculty, alumni, and practicing professional biologists, as well as panel discussions with professionals from industry."
advanced machine learning methods,COGS 185,Advanced Machine Learning Methods,This course is an advanced seminar and project course that follows the introduction to machine learning courses. Advanced and new machine learning methods will be discussed and used.
advanced machine learning methods,MAE 146,Introduction to Machine Learning Algorithms,"An introduction to the principles used to design and implement machine learning algorithms, as well as an understanding of their advantages and limitations. The topics covered are python review, supervised learning (linear, logistic/sigmoid regression, generalized linear models, nonlinear regression via Kernels), neural network types (convolutional, recurrent, deep NN), unsupervised learning (k-means clustering). Application of ML in different examples. Recommended preparation: ECE 143 and/or python programming knowledge."
advanced machine learning methods,DSC 240,Machine Learning,"A graduate level course in machine learning algorithms: decision trees, principal component analysis, k-means, clustering, logistic regression, random forests, boosting, neural networks, kernel methods, deep learning."
advanced machine learning methods,CSE 151A,Introduction to Machine Learning,"Broad introduction to machine learning. The topics include some topics in supervised learning, such as k-nearest neighbor classifiers, decision trees, boosting, and perceptrons; and topics in unsupervised learning, such as k-means and hierarchical clustering. In addition to the actual algorithms, the course focuses on the principles behind the algorithms. Students may not receive credit for both CSE 151A and COGS 188, nor may they receive credit for both CSE 151A and CSE 151."
advanced machine learning methods,DSC 250,Advanced Data Mining,"Graph mining and basic text analysis (including keyphrase extraction and generation), set expansion and taxonomy construction, graph representation learning, graph convolutional neural networks, heterogeneous information networks, label propagation, and truth findings."
ai,COGS 188,Artificial Intelligence Algorithms,This class will cover a broad spectrum of machine learning algorithms. It builds on students’ previous exposure to machine learning. It covers new artificial intelligence algorithms ranging from topic models as used in the text data analysis to genetic algorithms. Students will not receive credit for both COGS 188 and CSE 151A.
ai,CSE 259,Seminar in Artificial Intelligence,"A weekly meeting featuring local (and occasional external) speakers discussing their current research in artificial intelligence neural networks, and genetic algorithms. (S/U grades only.)"
ai,LTCS 108,"Gender, Race, and Artificial Intelligence","This course explores the idea of artificial intelligence in both art and science, its relation to the quest to identify what makes us human, and the roles gender and race have played in both. Students may not receive credit for CGS 108 and LTCS 108."
ai,CSE 150B,Introduction to Artificial Intelligence: Search and Reasoning,"The course will introduce important ideas and algorithms in search and reasoning and demonstrate how they are used in practical AI applications. Topics include A* search, adversarial search, Monte Carlo tree search, reinforcement learning, constraint solving and optimization, propositional and first-order reasoning."
ai,CGS 108,"Gender, Race, and Artificial Intelligence","(Cross-listed with LTCS 108.) This course explores the idea of artificial intelligence in both art and science, its relation to the quest to identify what makes us human, and the role gender and race have played in both. Students may not receive credit for CGS 108 and LTCS 108."
algae,SIO 183,Phycology: Marine Plant Biology,"Lecture and laboratory course emphasizing the biology, ecology and taxonomy of marine plants and seaweeds. Laboratory work mainly involves examination, slide preparation and dissection of fresh material collected locally. An oral presentation on a current research topic is required. Program or course fee may apply."
algae,SIOB 283,Phycology: Marine Plant Biology,"Lecture and laboratory course emphasizing the biology, ecology and taxonomy of marine plants and seaweeds. Laboratory work mainly involves examination, slide preparation and dissection of fresh material collected locally. An oral presentation on a current research topic is required. Program or course fee may apply. Graduate students, additionally, are required to write a research paper. Offered in alternate years. May be coscheduled with SIO 183. Renumbered from SIO 283. Students may not receive credit for SIO 283 and SIOB 283. Program or materials fees may apply."
algae,SIOB 282,Phytoplankton Diversity,"Molecular, biochemical, ecological, and evolutionary perspectives on the diversity of eukaryotic and prokaryotic phytoplankton."
algae,SIO 188,Biology of Fishes,"The comparative evolution, morphology, physiology, and ecology of fishes. Special emphasis on local, deep-sea, and pelagic forms in laboratory."
algae,SIOB 294,Biology of Fishes,"The comparative evolution, morphology, physiology, and ecology of fishes. Special emphasis on local, deep-sea, and pelagic forms in laboratory."
algebra,MATH 200A,Algebra I,"First course in graduate algebra. Topics may include group actions, Sylow theorems, solvable and nilpotent groups, free groups and presentations, semidirect products, polynomial rings, unique factorization, chain conditions, modules over principal ideal domains, rational and Jordan canonical forms, tensor products, projective and flat modules, Galois theory, solvability by radicals, localization, primary decomposition, Hilbert Nullstellensatz, integral extensions, Dedekind domains, Krull dimension."
algebra,MATH 200B,Algebra II,"Second course in graduate algebra. Topics may include group actions, Sylow theorems, solvable and nilpotent groups, free groups and presentations, semidirect products, polynomial rings, unique factorization, chain conditions, modules over principal ideal domains, rational and Jordan canonical forms, tensor products, projective and flat modules, Galois theory, solvability by radicals, localization, primary decomposition, Hilbert Nullstellensatz, integral extensions, Dedekind domains, Krull dimension."
algebra,MATH 200C,Algebra III,"Third course in graduate algebra. Topics may include group actions, Sylow theorems, solvable and nilpotent groups, free groups and presentations, semidirect products, polynomial rings, unique factorization, chain conditions, modules over principal ideal domains, rational and Jordan canonical forms, tensor products, projective and flat modules, Galois theory, solvability by radicals, localization, primary decomposition, Hilbert Nullstellensatz, integral extensions, Dedekind domains, Krull dimension."
algebra,MATH 103A,Modern Algebra I,"First course in a two-quarter introduction to abstract algebra with some applications. Emphasis on group theory. Topics include definitions and basic properties of groups, properties of isomorphisms, subgroups. (Students may not receive credit for both MATH 100A and MATH 103A.)"
algebra,MATH 100A,Abstract Algebra I,"First course in a rigorous three-quarter introduction to the methods and basic structures of higher algebra. Topics include groups, subgroups and factor groups, homomorphisms, rings, fields. (Students may not receive credit for both MATH 100A and MATH 103A.)"
algos,SIO 121GS,Geology of the Alps,"This global seminar course will examine the geology of the Alps range. Students will develop an in-depth understanding of the geology, tectonics, and geomorphology of this fascinating, beautiful, and geologically complex region. The course will focus closely on the tectonics of the region and the subsequent geologic processes that have shaped it (e.g., glaciation) since the late Mesozoic Alpine Orogeny. Classroom study will be strongly augmented with local and regional field excursions. Program or materials fees may apply."
algos,LTGK 2,Intermediate Greek (I),"Continuation of study of ancient Greek, including grammar and reading."
algos,CSE 221,Operating Systems,"Operating system structures, concurrent computation models, scheduling, synchronization mechanisms, address spaces, memory management protection and security, buffering, streams, data-copying reduction techniques, file systems, naming, caching, disk organization, mapped files, remote file systems, case studies of major operating systems."
algos,NO RESULTS,NO RESULTS,NO RESULTS
algos,NO RESULTS,NO RESULTS,NO RESULTS
analytics,MGT 151R,Business Analytics,"This course focuses on the concept of data analytics, and the convergence of data and business. From a practical standpoint, the course focuses on solving business problems by examining industry data, machine learning, statistics, and various forms of data analytics concepts. The fundamental goal of the course is to ensure students learn and understand fundamental interconnections and practical coding applications within the field of data analytics. This course is a distance education course."
analytics,MGTA 466,Scalable Analytics,"This course is designed to provide students with skills and knowledge to perform analytics at scale. Topics include steps in the analytics process used to gather, prepare, process, and evaluate data; basic principles of computer systems and parallelism; scalable computing; and cloud-based analytics. Hands-on experience with widely used scalable and cloud platforms will be provided. Through programming assignments, students will apply what they learn in the course to leverage big data."
analytics,MGTA 453,Business Analytics,"This course is designed to help a business manager to use data to make good decisions in complex decision-making situations. Several analytical and econometric methods will be covered including decision analysis, regression analysis, optimization, and simulation."
analytics,DSC 208R,Data Management for Analytics,"Principles, techniques, and tools for organizing, storing, querying, transforming, and using data for analytics and machine learning computations at scale; including the relational data model, relational algebra, database system features for faster querying, and non-relational data systems. Introduction to data quality issues, data cleansing, cluster and cloud computing, and transformation for feature engineering. Evaluation of analytics results including reasoning about bias and fairness. This is a distance education course."
analytics,MGTA 414,Web Data Analytics,"This course focuses on collecting, drawing inference, and making business decisions based on data. It will cover tools such as Python, APIs, and NLP to collect, manipulate, and analyze data from the web and other sources, with the objective of making students data-savvy and comfortable with deriving insights from real-world, large data sets. Students will be exposed to the power of clickstream analysis and the possibilities that can be unleashed from industrial applications of web data analytics."
animal,COGS 142,Animal Communication,"This course introduces the study of animal communication, the key terminology, the remarkable communicative systems that several animal species possess, and the key similarities and differences between human and non-human animals’ communications."
animal,PSYC 122,Mechanisms of Animal Behavior,This course focuses on approaches to the study of behavior and its underlying fundamental units of analysis in human and nonhuman animals. Students may not receive credit for both PSYC 122 and PSYC 103.
animal,ANTH 102,Humans Are Cultural Animals,"This class examines humans from a comparative perspective; if we ignore culture, what’s left? How do culture and biology interact? And how does biology inform cultural debates over race, sex, marriage, war, peace, etc.?"
animal,COGS 143,Animal Cognition,"Examines the contrasts and parallels between primates and cetaceans in sensorimotor constraints, neuroanatomy, field behavior, and cognition in the lab, with a focus on the demands of competition and cooperation that helped shape the evolution of social cognition. Students may not receive credit for COGS 143 and COGS 143GS."
animal,PSYC 118,Laboratory in Animal Behavior,"This course provides an opportunity to learn about the various evolutionary forces that shape a species’ natural behavioral repertoire while also conducting research related to these issues. Classroom lectures on topics related to ethology will be complemented by a research project in which students collect observational data on animal behavior. Open to the following majors only: PC26, PC28, PC29, PC30, PC31, PC32, PC33, PC34, CG32."
aquarium,SIO 197BA,Birch Aquarium Internship,This internship will examine basic science learning theory and interpretive techniques best suited for learners in an aquarium or informal learning setting. Students will demonstrate learned skills by facilitating floor-based interactions and conducting visitor surveys that influence aquarium exhibit design and guest experiences. Interested students should contact the Scripps undergraduate office for application instructions. P/NP grades only.
aquarium,SIO 188,Biology of Fishes,"The comparative evolution, morphology, physiology, and ecology of fishes. Special emphasis on local, deep-sea, and pelagic forms in laboratory."
aquarium,SIOB 294,Biology of Fishes,"The comparative evolution, morphology, physiology, and ecology of fishes. Special emphasis on local, deep-sea, and pelagic forms in laboratory."
aquarium,NO RESULTS,NO RESULTS,NO RESULTS
aquarium,NO RESULTS,NO RESULTS,NO RESULTS
archaeology,ANTH 3,Global Archaeology,"This course examines theories and methods used by archaeologists to investigate the origins and nature of human culture and its materiality. Case studies from the past and present, and digital heritage are explored. Recommended for many upper-division archaeology courses."
archaeology,ANTH 288,Archaeology Practicum,Field and laboratory training for graduate students in archaeology. Students will design and implement archaeological fieldwork or analyze data collected in the field.
archaeology,ANTH 258,Analytical Methods in Archaeology,"Specialized scientific techniques are increasingly important to archaeology. This seminar examines chronometric date techniques, site-formation processes, and geoarchaeology and pedology, chemical analyses of soils, zooarchaeology, paleoethnobotany, and how land-use strategies can be inferred from archaeological remains."
archaeology,ANAR 111,Foundations of Archaeology,"As part of the broad discipline of anthropology, archaeology provides the long chronological record needed for investigating human and social evolution. The theories and methods used in this field are examined. (Archaeology core sequence course.) Recommended preparation: ANTH 3."
archaeology,ANAR 124,Archaeology of Asia,"This course explores the archaeology of Asia from the first humans through the rise of state societies. Topics include the environmental setting, pioneer migrations, hunting and gathering societies, plant and animal domestication, and the development of metallurgy, agriculture, technology, trade, and warfare in early civilizations. We consider how ancient political, intellectual, and artistic achievements shape the archaeological heritage in present-day Asia."
art,VIS 110H,Art and Text,"This class is for the advanced visual arts major devoted to the study and practice of the multiple ways in which writing and other forms of visible language have been incorporated into contemporary and traditional artworks, including artists’ books, collaging and poster art, literature and poetry, typographical experiments, and calligraphies. Two production-course limitation."
art,PHIL 175,Aesthetics,"Central issues in philosophical aesthetics such as the nature of art and aesthetic experience, the grounds of artistic interpretation and evaluation, artistic representation, and the role of the arts in education, culture, and politics. May be taken for credit two times."
art,VIS 120B,Roman Art,"Roman art was the “modern art” of antiquity. Out of their Italic tradition and the great inheritance of Greek classic and Hellenistic art, the Romans forged a new language of form to meet the needs of a vast empire, a complex and tumultuous society, and a sophisticated, intellectually diverse culture. An unprecedented architecture of shaped space used new materials and revolutionary engineering techniques in boldly functional ways for purposes of psychological control and symbolic assertion. Sculpture in the round and in relief was pictorialized to gain spatial effects and immediacy of presence, and an extraordinary art of portraiture investigated the psychology while asserting the status claims of the individual. Extreme shifts of style, from the classicism of the age of Augustus to the expressionism of the third century AD, are characteristic of this period. The new modes of architecture, sculpture, and painting, whether in the service of the rhetoric of state power or of the individual quest for meaning, were passed on to the medieval and ultimately to the modern West. Recommended preparation: VIS 20."
art,VIS 202,Art Practice,"A workshop/seminar devoted to a particular materials practice (e.g., media, painting, digital media, etc.) that engages with critical questions arising within that discipline. Content will vary from quarter to quarter. May be taken for credit two times. (Required, MFA)"
art,VIS 125BN,Contemporary Art,"Art after abstract expressionism: happenings, postpainterly abstraction, minimalism, performance, earth art, conceptual art, neo-expressionism, postconceptualism and development in the 1990s, including non-Western contexts. We also explore the relation of these tendencies to postmodernism, feminism, and ideas of postcoloniality. Recommended preparation: VIS 20 or 22 recommended."
