Query,Class Code,Class Title,Class Description
database,CSE 232,Principles of Database Systems,"(Formerly CSE 264D.) Database models including relational, hierarchic, and network approaches. Implementation of databases including query languages and system architectures."
deep learning,CSE 151B,Deep Learning,"(Formerly CSE 154.) This course covers the fundamentals of neural networks. We introduce linear regression, logistic regression, perceptrons, multilayer networks and back-propagation, convolutional neural networks, recurrent networks, and deep networks trained by reinforcement learning. Students may receive credit for one of the following: CSE 151B, CSE 154, or COGS 181."
deep learning,COGS 181,Neural Networks and Deep Learning,"This course will cover the basics about neural networks, as well as recent developments in deep learning including deep belief nets, convolutional neural networks, recurrent neural networks, long-short term memory, and reinforcement learning. We will study details of the deep learning architectures with a focus on learning end-to-end models for these tasks, particularly image classification. Students may receive credit for one of the following: COGS 181, CSE 151B, or CSE 154."
deep learning,ECE 271C,Deep Learning and Applications,"Foundations of deep learning. Deep learning architectures and learning algorithms. Feedforward, convolutional, and recurrent networks. Regularization. Applications to vision, speech, or text processing."
deep learning,ECE 176,Introduction to Deep Learning and Applications,"This course covers the fundamentals in deep learning, basics in deep neural network including different network architectures (e.g., ConvNet, RNN), and the optimization algorithms for training these networks. We will have hands-on implementation courses in PyTorch. This course will also introduce the deep learning applications in computer vision, robotics, and sequence modeling in natural language processing."
deep learning,ECE 226,Optimization and Acceleration of Deep Learning on Various Hardware Platforms,"This course aims to present the mathematical and computational challenges for holistic content/algorithm/hardware codesign of an efficient deep learning framework. Participants will discuss selected topics including DNNs, CNNs, and RNNs in both supervised and unsupervised settings. Special emphasis will be on optimizing DL physical performance on different hardware platforms. The hardware platforms include CPU-CPU and CPU-GPU architectures."
definite integrals,MATH 10B,Calculus II,"Integral calculus of functions of one variable, with applications. Antiderivatives, definite integrals, the Fundamental Theorem of Calculus, methods of integration, areas and volumes, separable differential equations. (No credit given if taken after or concurrent with MATH 20B.)"
definite integrals,MATH 20E,Vector Calculus,"Change of variable in multiple integrals, Jacobian, Line integrals, Green’s theorem. Vector fields, gradient fields, divergence, curl. Spherical/cylindrical coordinates. Taylor series in several variables. Surface integrals, Stoke’s theorem. Gauss’ theorem. Conservative fields."
definite integrals,MATH 240B,Real Analysis II,"Second course in graduate real analysis. Abstract measure and integration theory, integration on product spaces. Lebesgue measure and integral, Lebesgue-Stieltjes integrals, functions of bounded variation, differentiation of measures. Locally compact Hausdorff spaces, Banach and Hilbert spaces, linear functionals. Lebesgue spaces and interpolation, elements of Fourier analysis and distribution theory."
definite integrals,NO RESULTS,NO RESULTS,NO RESULTS
definite integrals,NO RESULTS,NO RESULTS,NO RESULTS
design,ECE 190,Engineering Design,"Students complete a project comprising at least 50 percent or more engineering design to satisfy the following features: student creativity, open-ended formulation of a problem statement/specifications, consideration of alternative solutions/realistic constraints. Written final report required."
design,ENG 100D,Design for Development,"An introduction to the practice of human-centered design and team engineering within a humanitarian context. Includes a group project designing a solution for a local or global nonprofit organization. Topics include design process, contextual listening, project management, needs and capacity assessment, stakeholder analysis, ethical issues, models of leadership, gender and cultural issues, sustainable community development, and social entrepreneurship. ENG 100D is the gateway course for the Global TIES program, but it is open to all undergraduate students. Please go to http://globalties.ucsd.edu for information about Global TIES. Recommended preparation: one university-level mathematics course."
design,CSE 170,Interaction Design,"Introduces fundamental methods and principles for designing, implementing, and evaluating user interfaces. Topics include user-centered design, rapid prototyping, experimentation, direct manipulation, cognitive principles, visual design, social software, software tools. Learn by doing: Work with a team on a quarter-long design project. Students may not receive credit for COGS 120 and CSE 170. Recommended preparation: Basic familiarity with HTML."
design,COGS 120,Interaction Design,"Introduces fundamental methods and principles for designing, implementing, and evaluating user interfaces. Topics: user-centered design, rapid prototyping, experimentation, direct manipulation, cognitive principles, visual design, social software, software tools. Learn by doing: work with a team on a quarter-long design project. Recommended preparation: basic familiarity with HTML. Students may not receive credit for both COGS 120 and CSE 170."
design,DSGN 161,Design Project,Special topics in design. May be taken for credit three times when topics vary. Recommended preparation: may require shop skills.
digital design,ECE 25,Introduction to Digital Design,"This course emphasizes digital electronics. Principles introduced in lectures are used in laboratory assignments, which also serve to introduce experimental and design methods. Topics include Boolean algebra, combination and sequential logic, gates and their implementation in digital circuits. (Course materials and/or program fees may apply.)"
digital design,ECE 111,Advanced Digital Design Project,"Advanced topics in digital circuits and systems. Use of computers and design automation tools. Hazard elimination, synchronous/asynchronous FSM synthesis, synchronization and arbitration, pipelining and timing issues. Problem sets and design exercises. A large-scale design project. Simulation and/or rapid prototyping."
digital design,TDDE 151,Digital Video Design,"This course will examine the field of projection design for theatre and dance performance. Students will study and produce original works based on the theoretical and aesthetic approaches of animation, film, performance, and installation art that influence contemporary projection design."
digital design,VIS 110K,Digital Studio,"This is a studio art course for the advanced visual arts major with a focus on the intersection of digital rendering and drawing, painting, sculpture, and performance. Structured as core lectures and labs, studio production, reading, and critical theory focused on contemporary art engaged with technology, as well as artists’ responses to its demands. Two production-course limitation."
digital design,CSE 140,Components and Design Techniques for Digital Systems,"Design of Boolean logic and finite state machines; two-level, multilevel combinational logic design, combinational modules and modular networks, Mealy and Moore machines, analysis and synthesis of canonical forms, sequential modules."
digital photography,VIS 60,Introduction to Digital Photography,"An in-depth exploration of the camera and image utilizing photographic digital technology. Emphasis is placed on developing fundamental control of the processes and materials through lectures, field, and lab experience. Basic discussion of image making included. Program or materials fees may apply."
digital photography,VIS 9,Introduction to Digital Photography for Non-Majors,"This course is a general study of the camera and photography utilizing digital technology. Emphasis is placed on developing fundamental manual control, understanding composition, and basic photographic techniques through lectures and field exercises."
digital photography,VIS 182A,Advanced Digital Photography Editing,"Approaching digital editing from a theoretical perspective. How does manipulation work with and against claims of truth in photography? How have artists used image manipulation toward conceptual means? Students will learn advanced editing techniques in Photoshop while learning about the political, social, and personal implications of the altered image landscape. Two production-course limitation."
digital photography,ANSC 183,"Visualizing the Human: Film, Photography, and Digital Technologies","Explores the role of film, photography, digital media, and visualization technologies in understanding human life. Students develop their own visualization projects."
digital photography,CSE 273,Computational Photography,"Computational photography overcomes the limitations of traditional photography using computational techniques from image processing, computer vision, and computer graphics. This course provides a comprehensive introduction to computational photography and the practical techniques used to overcome traditional photography limitations (e.g., image resolution, dynamic range, and defocus and motion blur) and those used to produce images (and more) that are not possible with traditional photography. Linear algebra, calculus, and optimization, MATLAB, Python, or other programming experience recommended."
disability,COMM 108D,POB: Disability,"Cultural and historical ways of defining and understanding disability relative to communication and assistive technologies, including the impact of digital technologies and the Americans with Disabilities Act. Course use of audiovisual texts and writings from fields including science and technology studies, and cultural studies."
disability,TDGE 134,Disability and Performative Exploration: Struggle for Inclusion,"This class examines disability in the performative context, exploring the representation of people with disabilities and the struggle for access and inclusion. The frame of advocacy, understanding, and creative collaboration will deepen the historical perspective on disability."
disability,COGS 172,Brain Disorders and Cognition,A review of the patterns of impaired and intact cognitive abilities present in brain-damaged patients in terms of damage to one or more components of a model of normal cognitive functioning.
disability,NO RESULTS,NO RESULTS,NO RESULTS
disability,NO RESULTS,NO RESULTS,NO RESULTS
downsides of social media,MGT 481,Social Media Marketing,"Examine tools and frameworks to understand how companies can effectively implement social media marketing campaigns. Through case studies, experiments, research, and class discussion, explore how companies use these emerging technologies to reach and engage customers in powerful new ways. Letter grade only."
downsides of social media,POLI 100F,Social Networks,"This class explores the many ways in which face-to-face social networks have a powerful effect on a wide range of human behaviors. With a foundation in understanding real-world networks, we can then consider how these networks function online."
downsides of social media,SOCI 122,Social Networks,"This course takes a social network approach to the study of society, examining the complex web of relationships— platonic, familial, professional, romantic—in which individual behavior is embedded. Special emphasis is placed on the unprecedented opportunities created by contemporary social media (e.g., Facebook, mobile phones, online dating websites) for answering fundamental sociological questions."
downsides of social media,NO RESULTS,NO RESULTS,NO RESULTS
downsides of social media,NO RESULTS,NO RESULTS,NO RESULTS
drawing,VIS 105A,Drawing: Representing the Subject,"A studio course in beginning drawing covering basic drawing and composition. These concepts will be introduced by the use of models, still life, landscapes, and conceptual projects."
drawing,VIS 105B,Drawing: Practices and Genre,A continuation of VIS 105A. A studio course in which the student will investigate a wider variety of technical and conceptual issues involved in contemporary art practice related to drawing.
drawing,VIS 105C,Drawing: Portfolio Projects,"A studio course in drawing, emphasizing individual creative problems. Class projects, discussions, and critiques will focus on issues related to intention, subject matter, and context."
drawing,VIS 1,Introduction to Art Making: Two-Dimensional Practices,"An introduction to the concepts and techniques of two-dimensional art making with an emphasis on drawing. Lectures and studio classes will introduce skills and concepts of contemporary drawing practice in relation to a variety of genres such as illustration, comics, advertising, animation, and other forms of visualization. This course is offered only one time each year."
drawing,TDGE 133,Visual Ideas,"An exploration of fundamental ways of seeing and thinking about the performance space. A look at the design process as it reflects styles and attitudes through an examination of text/image/meaning/message in theatre, dance, opera, and visual arts. With a special emphasis on the “solution-finding process” in design, as a leap from text to context, to finalized design."
drugs,PSYC 181,Psychopharmacology—Drugs and Behavior,"This course provides an overview of basic principles of psychopharmacology, including psychological effects, brain mode of action, and patterns of use of psychoactive agents. Drugs discussed may include drugs of abuse and psychotherapeutics such as stimulants, opioids, sedative hypnotics, hallucinogens, marijuana, alcohol, cognitive enhancers, anxiolytics, antidepressants, and antipsychotics."
drugs,COGS 174,"Drugs: Brain, Mind, and Culture","This course explores how drugs interact with the brain/mind and culture. It covers evolutionary and historical perspectives, brain chemistry, pharmacology, expectancies and placebo effects, and models of addiction. It also provides a biopsychosocial survey of commonly used and abused substances."
drugs,CHEM 167,Medicinal Chemistry,"Basics of medicinal chemistry, emphasizing rigorous descriptions of receptor-protein structure, interactions, and dynamics; their implications for drug development; and an integrated treatment of pharmacodynamic and pharmacokinetic considerations in drug design. Treats computational approaches as well as practical experimental approaches."
drugs,PSYC 236,Substance Abuse,"Theory and research on the development, progression, and resolution of substance use and abuse will be reviewed and evaluated. Normal and abnormal patterns of substance involvement will be contrasted across the life span."
drugs,CHEM 253,Antibiotics,"The course focuses on the discovery and development of modern antibiotics. We will discuss the discovery, synthesis, medicinal chemistry, mechanism of action studies, and preclinical as well as clinical development of drugs that are currently being used in the therapy of bacterial infections. Emphasis will be given to compounds approved over the last three decades and investigational drugs that are in clinical trials."
economics,ECON 113,Mathematical Economics,Mathematical concepts and techniques used in advanced economic analysis; applications to selected aspects of economic theory.
economics,ECON 181,Topics in Economics,Selected topics in economics. May be taken for credit up to three times.
economics,ECON 132,Energy Economics,"Energy from an economic perspective. Fuel cycles for coal, hydro, nuclear, oil, and solar energy. Emphasis on efficiency and control of pollution. Comparison of energy use across sectors and across countries. Global warming. Role of energy in the international economy."
economics,ECON 147,Economics of Education,"Examination of issues in education using theoretical and empirical approaches from economics. Analysis of decisions to invest in education. Consideration of various market structures in education, including school choice and school finance programs."
economics,ECON 266,Economics of Natural Resources,Theoretical and empirical issues in natural resource economics. (Previously numbered ECON 242.)
electrical engineering,ECE 5,Introduction to Electrical and Computer Engineering,"An introduction to electrical and computer engineering. Topics include circuit theory, assembly, and testing, embedded systems programming and debugging, transducer mechanisms and interfacing transducers, signals and systems theory, digital signal processing, and modular design techniques."
electrical engineering,ECE 289,Special Topics in Electrical and Computer Engineering,A course to be given at the discretion of the faculty at which general topics of interest in electrical and computer engineering will be presented by visiting or resident faculty members. May be taken for credit six times provided each course is a different topic.
electrical engineering,ECE 180,Topics in Electrical and Computer Engineering,Topics of special interest in electrical and computer engineering. Subject matter will not be repeated so it may be taken for credit more than once.
electrical engineering,ECE 188,Topics in Electrical and Computer Engineering with Laboratory,Topics of special interest in electrical and computer engineering with laboratory. Subject matter will not be repeated so it may be taken for credit up to three times.
electrical engineering,CENG 255,Electrochemical Engineering,"Fundamentals of electrochemistry and electrochemical engineering. Structure of the double layer, cell potential and electrochemical thermodynamics, charge transfer kinetics, electrochemical transport phenomena, and introduction to colloidal chemistry. Applications such as corrosion prevention, electroplating, reactor design, batteries, and fuel cells."
electrodynamics,PHYS 203A,Advanced Classical Electrodynamics I,"A basic course in electromagnetism at the graduate level. Contents include special relativity, relativistic formulation of electrodynamics from the principle of least action, electrostatics, magnetostatics, multipoles, waves, light, diffraction, and multipole radiation."
electrodynamics,ECE 107,Electromagnetism,"Electrostatics and magnetostatics; electrodynamics; Maxwell’s equations; plane waves; skin effect. Electromagnetics of transmission lines: reflection and transmission at discontinuities, Smith chart, pulse propagation, dispersion. Rectangular waveguides. Dielectric and magnetic properties of materials. Electromagnetics of circuits."
electrodynamics,PHYS 203B,Advanced Classical Electrodynamics II,"Special theory of relativity, covariant formulation of electrodynamics, radiation from current distributions and accelerated charges, multipole radiation fields, waveguides and resonant cavities."
electrodynamics,PHYS 100A,Electromagnetism I,"Coulomb’s law, electric fields, electrostatics; conductors and dielectrics; steady currents, elements of circuit theory."
electrodynamics,BGGN 260,Neurodynamics,"Introduction to the nonlinear dynamics of neurons and simple neural systems through nonlinear dynamics, bifurcation theory, and chaotic motions. The dynamics of single cells is considered at different levels of abstraction, e.g., biophysical and “reduced” models for analysis of regularly spiking and bursting cells, their dynamical properties, and their representation in phase space. Laboratory exercises will accompany the lectures. Duplicate credit not allowed for cross-listed courses: BGGN 260, BENG 260, and PHYS 279."
electromagnetism,PHYS 100A,Electromagnetism I,"Coulomb’s law, electric fields, electrostatics; conductors and dielectrics; steady currents, elements of circuit theory."
electromagnetism,ECE 107,Electromagnetism,"Electrostatics and magnetostatics; electrodynamics; Maxwell’s equations; plane waves; skin effect. Electromagnetics of transmission lines: reflection and transmission at discontinuities, Smith chart, pulse propagation, dispersion. Rectangular waveguides. Dielectric and magnetic properties of materials. Electromagnetics of circuits."
electromagnetism,PHYS 100C,Electromagnetism III,"Electromagnetic waves, radiation theory; application to optics; motion of charged particles in electromagnetic fields; relation of electromagnetism to relativistic concepts."
electromagnetism,SIOG 231,Geomagnetism and Electromagnetism,"Observations of Earth’s internal and external magnetic fields are used to study the core geodynamo and to image the electrical conductivity structure of the crust and mantle. This course will cover the theory of geomagnetism and electromagnetic induction, instrumentation, forward and inverse modeling of geomagnetic and electromagnetic data, properties of Earth materials, and applications. Renumbered from SIO 231. Students will not receive credit for both SIOG 231 and SIO 231."
electromagnetism,PHYS 100B,Electromagnetism II,"Magnetic fields and magnetostatics, magnetic materials, induction, AC circuits, displacement currents; development of Maxwell’s equations."
engineering,ECE 190,Engineering Design,"Students complete a project comprising at least 50 percent or more engineering design to satisfy the following features: student creativity, open-ended formulation of a problem statement/specifications, consideration of alternative solutions/realistic constraints. Written final report required."
engineering,ENG 210,Systems Engineering,"This course examines the complexity of integrating components of product engineering, marketing and client requirements into a single engineering system. Case studies explore successes and failures in engineered systems and how to detect and avoid potential failures using strong leadership skills, systemic analysis and thinking."
engineering,MAE 207,Topics in Engineering Science,A course to be given at the discretion of the faculty in which topics of current interest in engineering will be presented.
engineering,ENG 15,Engineer Your Success,"Engineer Your Success is designed to enhance your success as an engineering student (and later as an engineer) by developing key academic and personal skills. Learn how to study more effectively and uncover how to become the best engineer you can be. This course focuses on academic and personal planning, time management, study skills, and paths to personal growth. Activities include individual and collaborative exercises, personal reflections, and a final project."
engineering,ENG 20,Introduction to Engineering Research,"Introduction to research in engineering. Topics include defining a research problem, finding and reading technical papers, technical writing, and effective practices for presenting research. Students write a proposal on their lab placement research project. This course is for students in the Guided Engineering Apprenticeship in Research (GEAR)."
environmental engineering,MAE 126B,Environmental Engineering Design,"Fundamental principles of environmental design. Building a working prototype or computer model for an environmental engineering application. Work in teams to propose and design experiments and components, obtain data, complete engineering analysis, and write a report. Engineering ethics and professionalism."
environmental engineering,MAE 126A,Environmental Engineering Laboratory,"Analysis of experiments in Environmental Engineering: Drag in a water tunnel, shading effects on solar photovoltaic, buoyant plume dispersion in a water tank, atmospheric turbulence, and others. Use of sensors and data acquisition. Laboratory report writing; error analysis; engineering ethics."
environmental engineering,CHEM 171,Environmental Chemistry I,"An introduction to chemical concerns in nature with emphasis on atmospheric issues like air pollution, chlorofluorocarbons and the ozone hole, greenhouse effects and climate change, impacts of radioactive waste, sustainable resource usage, and risks and benefits of energy sources. Students may only receive credit for one of the following: CHEM 149A or 171."
environmental engineering,ESYS 101,Environmental Biology,"This course surveys biochemical and physiological processes governing the relationship between organisms and their environments, such as those involved in element cycling and cellular homeostasis. The course introduces biological perspectives on human activities ranging from antibiotic use to genetic engineering."
environmental engineering,ECON 268,Energy and Environmental Economics,"Designed to prepare graduate students for original research in environmental or energy economics. Topics include theory and empirical study of economic regulation, energy markets, technological change, pollution and other externalities, energy efficiency, and climate change. Emphasis on empirical applications."
ethics of social media,PHIL 160,Ethical Theory,"Systematic and/or historical perspectives on central issues in ethical theory such as deontic, contractualist, and consequentialist conceptions of morality; rights and special obligations; the role of happiness and virtue in morality; moral conflict; ethical objectivity and relativism; and the rational authority of morality."
ethics of social media,DSC 267R,Data Fairness and Ethics,"Examination of the inevitable ethical questions and issues that arise in all stages of data science, including issues of privacy, bias, trust, and more. Conceptual and mathematical tools that can be used both to recognize and address these ethical issues as they arise in real-world practice. This is a distance education course."
