Query,Class Code,Class Title,Class Description
business,MGTP 414,Business Law,"Focuses on elements of business law that are essential for the basic management of business operations. Topics include the law of contracts, sales, partnership, corporations, securities, accountants’ legal liability, and Sarbanes Oxley statutes."
business,MGT 117,Business Law,"Focuses on elements of business law that are essential for the basic management of business operations. Topics include the law of contracts, sales, partnership, corporations, bankruptcy, and securities. Students will also gain knowledge of intellectual property law and dispute resolution."
business,GPIM 461,Doing Business in China,"This course describes the Chinese commercial, organizational, and cultural environment. Case studies of foreign businesses in China are examined, and the opportunities and pitfalls of operation in China are considered. Negotiation with Chinese counterparts is covered through a negotiation exercise. The focus is on mainland China, but some attention is given to business in Hong Kong and Taiwan as well. Students are required to prepare business plans for proposed Chinese ventures. Renumbered from IRGN 461. Students may not receive credit for GPIM 461 and IRGN 461."
business,MGT 417,Current Business Law Issues,"Explores current issues in business law, emphasizing concerns faced by new companies. Students learn how the law regulates and shapes businesses; examine the legal role in business formations, operations, and dissolutions; and gain knowledge of contract and intellectual property law. Letter grades only. Students may not earn credit for both MGT 417 and MGT 212. Also, students may not receive credit for both MGT 417 and MGT 219 with the course subtitle Current Business Law Issues."
business,MGT 180,Business Finance,"This course provides an introduction to the fundamental concepts in corporate finance. Topics include discounted cash flow, capital budgeting, bond and stock valuation, portfolio theory, market efficiency, the Capital Asset Pricing Model (CAPM), the determinants of capital structure and options. We will seek a balance between theoretical paradigms, the empirical facts, and their applicability to real-world issues. Emphasis will be placed on general principles and problem solving. Students will not receive credit for both MGT 180 and MGT 180R."
chamber music,MUS 230,Chamber Music Performance,"Performance of representative chamber music literature, instrumental and/or vocal, through coached rehearsal and seminar studies. Course may be repeated for credit since the literature studied varies from quarter to quarter."
chamber music,MUS 130,Chamber Music Performance,"Instruction in the preparation of small group performances of representative instrumental and vocal chamber music literature. May be taken for credit six times, after which students must enroll for zero units."
chamber music,MUS 200,Contemporary Chamber Opera Performance,Students will collaborate with faculty and guest artists in the preparation and performance of a fully staged contemporary chamber opera. The opera will be presented in multiple public performances.
chamber music,MUS 101B,Music Theory and Practice II,"Study of tonal harmony and counterpoint. Analysis of Bach chorales and other music from the Baroque period. Musicianship studies: sight-singing, dictation, and keyboard skills."
chamber music,MUS 101C,Music Theory and Practice III,"Tonal harmony and counterpoint. Analysis of larger classical forms: Sonata, Variation, Minuet and Trio, Rondo. Musicianship studies: sight-singing, dictation, and keyboard skills."
city planning,USP 100,Introduction to Urban Planning,"This course is designed to provide an introduction to the fundamentals of urban planning. It surveys important topics in urban planning, including economic development, urban design, transportation, environmental planning, housing, and the history of urban planning."
city planning,USP 189,Special Topics in Urban Planning,An undergraduate course designed to cover various aspects of Urban Planning. May be taken for credit up to two times.
city planning,USP 180,Transportation Planning,"Introduction to the history and current state of urban transportation planning, including the relationship between transportation and urban form; role of automotive, mass transit, and alternative modes; methods for transportation systems analysis; decision-making, regulatory, and financing mechanisms; and public attitudes. May be coscheduled with USP 280."
city planning,USP 15,Applied Urban Economics for Planning and Development,"This course explores how economics contributes to understanding and solving urban problems using a “learn by doing” approach. Economic analysis will be applied to important issues that planners and developers must deal with, such as land markets, housing, and zoning."
city planning,USP 173,History of Urban Planning and Design,The analysis of the evolution of city designs over time; study of the forces that influence the form and content of a city: why cities change; comparison of urban planning and architecture in Europe and the United States. Students may not receive credit for USP 173 and USP 173GS.
code,ECE 259A,Algebraic Coding,"Fundamentals of block codes, introduction to groups, rings and finite fields, nonbinary codes, cyclic codes such as BCH and RS codes, decoding algorithms, applications. Students who have taken ECE 259AN may not receive credit for ECE 259A."
code,LIGN 121,Syntax I,What universal principles determine how words combine into phrases and sentences? Introduction to research methods and results. Emphasis on how argumentation in problem-solving can be used in the development of theories of language.
code,COGS 101C,Language,"An introduction to structure of natural language, and to the cognitive processes that underline its acquisition, comprehension, and production. This course covers findings from linguistics, computer science, psychology, and cognitive neuroscience to provide an integrated perspective on human language abilities."
code,ECE 255B,Source Coding,"Theory and practice of lossy source coding, vector quantization, predictive and differential encoding, universal coding, source-channel coding, asymptotic theory, speech and image applications. Students that have taken 255BN cannot take 255B for credit. Recommended preparation: ECE 250, and 259A or 259AN."
code,LIGN 221,Syntax,"An introduction to syntactic phenomena, argumentation, analyses, and theoretical models. Phenomena to be discussed include phrase structure, argument structure, binding, control, and A- and A’-dependencies."
communication ,COMM 10,Introduction to Communication,"Introduction to the history, theory, and practice of communication, including language and literacy, representation and semiotics, mediated technologies and institutional formations, and social interaction. Integrates the study of communication with a range of media production (for example, writing, electronic media, film, performance). COMM 10 may be taken concurrently with the COMM A-B-C courses and intermediate electives. Course is offered fall, winter, and summer quarters."
communication ,COGR 258,Language in Human Communication,"In this course language is broadly conceived as a medium of communication, expressed multimodally. Among the topics of this course are origins of speech and gesture, culture and language, language and social practice, and language in performance."
communication ,BGGN 205,Communicating Science,"Learn effective ways of communicating science in both written and verbal form. Develop an understanding of how to effectively present science for different audiences, including writing for grants and papers, figure generation, and oral presentations. S/U grades only."
communication ,COMM 115,Communication and the Senses,"While we often assume that communication is something that happens only with our eyes and/or ears, every act of communication is multisensory, often involving sight and sound but also smell, touch, and taste. In this course, students will learn how to pay attention to and engage with the “other” senses beyond the visual and auditory. Interdisciplinary scholarship and empirical activities help students build a vocabulary for understanding the complexities of multisensory communication."
communication ,COGR 241,Geography and Communication,Geographies as media of political cultural communication. Not simply mapping but also territorial engineering as a way of constituting geographical significance. Cross-mapping practices—intersecting representational practices—as political forms of communication. Geographies as visual practices of power.
composite,SE 142,Design of Composite Structures,"Introduction to advanced composite materials and their applications. Fiber and matrix properties, micromechanics, stiffness, ply-by-ply stress, hygrothermal behavior, and failure prediction. Lab activity will involve design, analysis, fabrication, and testing of composite structure. Program or materials fees may apply."
composite,SE 253A,Mechanics and Design of Composite Structures,"Graduate-level introduction to advanced composite materials and their applications. Fiber and matrix properties, 3D properties, stress-strain relationships, micromechanics, stiffness, ply-by-ply stress, classical laminated plate theory, hygrothermal/CTE behavior, and failure prediction. Lab activity will involve composite fabrication methods and design, analysis, build, and testing of composite structure. May be coscheduled with SE 142. Program or materials fees may apply."
composite,SE 255,Textile Composite Structures,"Introduction to textile structure and behavior, mechanics of yarns and fabrics as relevant to structural composites and geotechnical applications. Mechanics of textiles and fabric-based composites. Applications in fiber reinforced composites, coated textile structures, geotextiles."
composite,SE 251A,Processing of Polymers and Composites,"Introduction to processing and fabrication methods of polymers and composite materials. Processing techniques; facilities and equipment; material-processing-microstructure interaction; materials selection; form and quality control. Extrusion; injection molding; blow molding; compression molding; thermoforming; casting; foaming. Wet layup; sprayup; autoclave cure, SMC; RTM; resin infusion; winding and fiber placement; pultrusion. Process induced defects and environmental considerations. Cross-listed with MATS 261A."
composite,MATS 261A,Processing of Polymers and Composites,"Introduction to processing and fabrication methods of polymers and composite materials. Processing techniques; facilities and equipment, material-processing-microstructure interaction, materials selection, form and quality control. Extrusion, injection molding, blow molding, compression molding, thermoforming, casting, foaming. Wet layup; sprayup; autoclave cure, SMC; RTM; resin infusion; winding and fiber placement; pultrusion. Process induced defects and environmental considerations."
computer science electives,CSE 197C,Cooperative Practicum in Computer Science and Engineering,Directed study accompanying full-time on-site computer science cooperative education practicum.
computer science electives,CSE 290,Seminar in Computer Science and Engineering,(Formerly CSE 280A.) A seminar course in which topics of special interest in computer science and engineering will be presented by staff members and graduate students under faculty direction. Topics vary from quarter to quarter. May be repeated for credit. (S/U grades only.)
computer science electives,CSE 599,Teaching Methods in Computer Science,Training in teaching methods in the field of computer science. This course examines theoretical and practical communication and teaching techniques particularly appropriate to computer science.
computer science electives,MATH 168A,Topics in Applied Mathematics—Computer Science,Topics to be chosen in areas of applied mathematics and mathematical aspects of computer science. May be taken for credit two times with different topics.
computer science electives,EDS 324DR,Teaching Methods in Computer Science,"Provides pedagogical and content knowledge and experiences to be an effective computer science teacher in the K-12 setting. Misconceptions in programming, teaching debugging, development of differentiated programming assignments, use of Use, Modify, Create approach, pedagogy, and classroom engagement practices for supporting student success. Experience teaching any programming language in the K-12 setting is recommended. Learning to teach Java is also recommended."
computer vision ,CSE 252A,Computer Vision I,"Comprehensive introduction to computer vision providing broad coverage including low-level vision (image formation, photometry, color, image feature detection), inferring 3-D properties from images (shape-from shading, stereo vision, motion interpretation) and object recognition. Companion to CSE 252B covering complementary topics."
computer vision ,CSE 252B,Computer Vision II,"Comprehensive introduction to computer vision providing focused coverage of multiview geometry, structure from motion, image segmentation, motion segmentation, texture analysis and recognition, object detection, and image-based rendering. Companion to CSE 252A covering complementary topics."
computer vision ,CSE 152B,Introduction to Computer Vision II,"This course covers advanced topics needed to apply computer vision in industry or follow current research. Example topics include real-time systems for 3-D computer vision, machine learning tools such as support-vector machine (SVM) and boosting for image classification, and deep neural networks for object detection and semantic segmentation."
computer vision ,CSE 152A,Introduction to Computer Vision I,"This course provides a broad introduction to the foundations, algorithms, and applications of computer vision. It introduces classical models and contemporary methods, from image formation models to deep learning, to address problems of 3-D reconstruction and object recognition from images and video. Topics include filtering, feature detection, stereo vision, structure from motion, motion estimation, and recognition. Programming assignments will be in Python. Students may not receive credit for both CSE 152A and CSE 152."
computer vision ,CSE 252D,Advanced Computer Vision,"This course covers advanced concepts in computer vision. Example topics include 3-D reconstruction, face recognition, object detection, semantic segmentation, action recognition, and domain adaptation. Consistent with recent developments, deep learning forms a significant fraction of the class. Lectures and assignments cover recent works on fundamental problems in computer vision, with the aim to prepare students for pursuing careers in the field. Recommended preparation: Completion of one of CSE 252A, 252B, 250A, or 250B is highly recommended."
computing,ECON 280,Computation,Introduction to computing for economists.
computing,COGS 3,Introduction to Computing,"Covers the fundamental concepts that underlie all programming languages and provides an introduction to the essential information about algorithms and data structures. Students design and implement web applications using HTML5, CSS3, JavaScript, and Photoshop. No previous programming experience is required."
computing,ECE 15,Engineering Computation,"Students learn the C programming language with an emphasis on high-performance numerical computation. The commonality across programming languages of control structures, data structures, and I/O is also covered. Techniques for using MATLAB to graph the results of C computations are developed."
computing,CSE 260,Parallel Computation,"(Formerly CSE 274A.) This course provides an overview of parallel hardware, algorithms, models, and software. Topics include Flynn’s taxonomy, interconnection networks, memory organization, a survey of commercially available multiprocessors, parallel algorithm paradigms and complexity criteria, parallel programming environments and tools for parallel debugging, language specification, mapping, performance, etc."
computing,VIS 142,Practices in Computing Arts,"A survey of the conceptual uses and historical precedents for the use of computers in art and design. Preparation for further study in the computing in the arts area by providing an introduction to ideation strategies and critique-based evaluation, and an overview of theoretical issues related to the use of computers by artists and designers. Introduces the students to the program’s computing and production facilities, and basic computer programming skills. Two production-course limitation. Program or materials fees may apply."
conservation,ECON 144,Economics of Conservation,"Examines conservation of biodiversity from an economic perspective. Topics include valuing biodiversity, defining successful conservation, and evaluating the cost effectiveness of policies such as conservation payments, ecotourism, and privatization. Emphasis on forests, coral reefs, elephants, tigers, and sea turtles."
conservation,ENVR 105,Conservation Solutions,"A project-based course in which students will develop and implement a curriculum module for high school students at the Dawson Los Monos Canyon Reserve. Includes an introduction to the natural history and resource management challenges of this ecological preserve. Students will conduct research projects which will be used to create a curriculum module for a high school environmental science course and guide high school students through field research and a discussion of conservation solutions. Course may include a required field trip, and students are responsible for their own transportation."
conservation,ANBI 132,Conservation and the Human Predicament,"Interdisciplinary discussion of the human predicament, biodiversity crisis, and importance of biological conservation. Examines issues from biological, cultural, historical, economic, social, political, and ethical perspectives emphasizing new approaches and new techniques for safeguarding the future of humans and other biosphere inhabitants."
conservation,ANBI 114,Methods in Primate Conservation,"Primate (and other vertebrate) conservation involves a variety of methods: field (e.g., population and habitat assessment), computer (e.g., population genetic models), and increasingly the web (e.g., interactive GIS and databases). Course takes problem-solving approach to learning some of these methods."
conservation,BIEB 176,Biology of Conservation and the Human Predicament,"Discussion of the human predicament, biodiversity crisis, and importance of biological conservation. Examines issues from biological perspectives emphasizing new approaches and new techniques for safeguarding the future of humans and other biosphere inhabitants."
convolutional neural networks,COGS 181,Neural Networks and Deep Learning,"This course will cover the basics about neural networks, as well as recent developments in deep learning including deep belief nets, convolutional neural networks, recurrent neural networks, long-short term memory, and reinforcement learning. We will study details of the deep learning architectures with a focus on learning end-to-end models for these tasks, particularly image classification. Students may receive credit for one of the following: COGS 181, CSE 151B, or CSE 154."
convolutional neural networks,CSE 151B,Deep Learning,"(Formerly CSE 154.) This course covers the fundamentals of neural networks. We introduce linear regression, logistic regression, perceptrons, multilayer networks and back-propagation, convolutional neural networks, recurrent networks, and deep networks trained by reinforcement learning. Students may receive credit for one of the following: CSE 151B, CSE 154, or COGS 181."
convolutional neural networks,ECE 271C,Deep Learning and Applications,"Foundations of deep learning. Deep learning architectures and learning algorithms. Feedforward, convolutional, and recurrent networks. Regularization. Applications to vision, speech, or text processing."
convolutional neural networks,DSC 257R,Unsupervised Learning,"Broad view of the field of unsupervised learning, in particular its most common methods and use cases. Topics include descriptive statistics; clustering; projection, singular value decomposition, and spectral embedding; common probability distributions; density estimation; graphical models and latent variable modeling; sparse coding and dictionary learning; autoencoders, shallow and deep; and self-supervised learning."
convolutional neural networks,ECE 176,Introduction to Deep Learning and Applications,"This course covers the fundamentals in deep learning, basics in deep neural network including different network architectures (e.g., ConvNet, RNN), and the optimization algorithms for training these networks. We will have hands-on implementation courses in PyTorch. This course will also introduce the deep learning applications in computer vision, robotics, and sequence modeling in natural language processing."
cooking,LTCS 165,Special Topics: The Politics of Food,"This course will examine the representation and politics of food in literary and other cultural texts. Topics may include food and poverty, the fast food industry, controversies about seed, sustainable food production, myths about hunger, eating and epistemology, aesthetics, etc. May be taken for credit up to three times as topics vary."
cooking,BIBC 120,Nutrition,"Elaborates the relationship between diet and human metabolism, physiology, health, and disease. Covers the functions of carbohydrates, lipids, proteins, vitamins, and minerals, and discusses dietary influences on cardiovascular disease, diabetes, obesity, and cancer."
cooking,ANSC 114,Food Cultures of South Asia,"This course explores the diverse food cultures of South Asia, focusing on the ways food, spices, and beverages shape identity, social relations, and cultural heritage. It will place food practices in the context of food security, sustainability, inequality, nutrition, family, and kinship. Students develop projects focused on understanding the cultural and historical significance of a particular food dish or regional culinary tradition."
cooking,NO RESULTS,NO RESULTS,NO RESULTS
cooking,NO RESULTS,NO RESULTS,NO RESULTS
covid 19,FPM 247,Clinical Epidemiology Seminar,"This seminar is designed to expand the student’s understanding of clinical epidemiology by investigating several major controversial issues, such as treatment of breast cancer, oral hypoglycemic in diabetes, and dietary habits as a risk factor for coronary artery disease. The seminar will address clinical and methodological issues in the epidemiology of various chronic diseases."
covid 19,FMPH 462,Non-Communicable Diseases and Global Health,"This course will focus on the health and economic burden of non-communicable diseases (NCD) globally, understanding global patterns of major diseases and disease categories (cancer, CVD, diabetes, obesity) and health behaviors (smoking, diet, physical activity), global health policy and advocacy, and intervention strategies and evaluation of health programs related to global NCD. We will cover select global health issues in a format allowing for in-depth discussion."
covid 19,GLBH 202,Global Health Epidemiology,"This course will address basic epidemiology principles, concepts, and procedures that are used in the investigation of health-related states or events from a global perspective. Explores study designs and methods appropriate for studies of incidence and prevalence, causality and prevention, with emphasis on research in resource-poor settings. May be coscheduled with GLBH 102."
covid 19,NO RESULTS,NO RESULTS,NO RESULTS
covid 19,NO RESULTS,NO RESULTS,NO RESULTS
creative writing ,LTSP 166,Creative Writing,A workshop designed to foster and encourage writing in Spanish of students working on short forms of fiction. The workshop will include discussions of techniques and intensive writing.
creative writing ,PSYC 176,Creativity,"This course provides an overview of how to foster creativity in individuals, groups, and organizations. Themes that cut across all three levels are highlighted."
creative writing ,PSYC 219,Writing about Thinking,"Students will study the cognitive faculties that govern our ability to read for comprehension, along with the opportunities and challenges they create for writers. By reading and discussing primary research, and through feedback on their own writing, students will learn to apply psychological science to the writing activities of psychological scientists (scientific reports, literature reviews, grant proposals, communication with colleagues and students, and writing for the general public)."
creative writing ,LTWR 8B,Writing Poetry,"Study and practice of poetry as artistic and communal expression. Techniques of composition (traditional forms, avant garde techniques, dramatic monologue, performance poetry, and new genre) studied through written and spoken examples of poetry. Students are required to attend at least three New Writing Series readings during the quarter."
creative writing ,TDGE 3,Cultivating the Creative Mind,"This course will use the theatrical context to integrate scientific research about creativity, group dynamics, and related topics. Through a mix of theoretical and experiential classes and assignments, we will explore the intersection of theatre and neuroscience, investigating and expanding the creative mind."
creativity,PSYC 176,Creativity,"This course provides an overview of how to foster creativity in individuals, groups, and organizations. Themes that cut across all three levels are highlighted."
